Start,End,What,With,Where,Tag,Why
2016-01-09,Present,Graduate Student,Robinson Lab,University of British Columbia,Research,Using genomics to investigate environmental and genetic influences on perinatal health
,,,,,,Modelling ethnicity using machine learning applied to epigenomic data
,,,,,,Conducted epigenome- and transcriptome- wide association studies using public and private repositories
2016-01-08,2017-01-01,Molecular Biodiversity Lab Assistant,Martone Lab,University of British Columbia,Research,Characterized the impact of weather changes on keystone species lost amon the coast of northern BC
,,,,,,Processed over 300 algal DNA specimens and applied BLAST for species identification 
2014-01-01,2016-08-30,Undergraduate Honours Thesis,Whiteway Lab,Concordia University,Research,Developed a gene-fusion-insertion protocol using CRISPR in c. albicans
